{
  "schema_version": "0.1.0",
  "fixture_id": "opus-5-5-service-tier-unlisted",
  "referenced_by": [
    "M5",
    "B3"
  ],
  "price_book": {
    "path": "price-book.example.json",
    "price_book_version": "2026-10-09.1",
    "entry_id": "anthropic.claude-opus-5-5"
  },
  "request": {
    "provider": "anthropic",
    "model": "claude-opus-5-5",
    "at": "2026-10-09T12:00:00Z",
    "org_id": null,
    "dimensions": {
      "speed": null,
      "service_tier": "priority",
      "inference_geo": "global"
    }
  },
  "usage": {
    "tokens": {
      "uncached_input": 3000,
      "cache_read": 90000,
      "cache_write_5m": 5000,
      "cache_write_1h": 0,
      "cache_write_unspecified": 0,
      "output": 2000
    },
    "fees": []
  },
  "expected": {
    "priced": false,
    "unpriced_dimensions": [
      "service_tier"
    ]
  }
}
