{
  "schema_version": "0.1.0",
  "fixture_id": "opus-5-5-fast-us",
  "referenced_by": [
    "M5",
    "M2"
  ],
  "price_book": {
    "path": "price-book.example.json",
    "price_book_version": "2026-10-09.1",
    "entry_id": "anthropic.claude-opus-5-5"
  },
  "request": {
    "provider": "anthropic",
    "model": "claude-opus-5-5",
    "at": "2026-10-09T12:00:00Z",
    "org_id": null,
    "dimensions": {
      "speed": "fast",
      "service_tier": null,
      "inference_geo": "us"
    }
  },
  "usage": {
    "tokens": {
      "uncached_input": 3000,
      "cache_read": 90000,
      "cache_write_5m": 5000,
      "cache_write_1h": 0,
      "cache_write_unspecified": 0,
      "output": 2000
    },
    "fees": []
  },
  "expected": {
    "priced": true,
    "rounding": "half_up",
    "classes": {
      "uncached_input": {
        "tokens": 3000,
        "rate_usd_per_mtok": "8.8",
        "cost_usd": "0.0264"
      },
      "cache_read": {
        "tokens": 90000,
        "rate_usd_per_mtok": "0.44",
        "cost_usd": "0.0396"
      },
      "cache_write_5m": {
        "tokens": 5000,
        "rate_usd_per_mtok": "11",
        "cost_usd": "0.055"
      },
      "output": {
        "tokens": 2000,
        "rate_usd_per_mtok": "44",
        "cost_usd": "0.088"
      }
    },
    "fees": [],
    "total_usd": "0.209",
    "total_nanodollars": 209000000
  }
}
